{
  "type": "sync",
  "id": "180bbc67-ed08-7846-a3d6-b82ada0b6f08",
  "creationDate": "2019-02-16T17:23:29.850Z",
  "version": 4,
  "application": {
    "architecture": "x86-64",
    "buildId": "20190213102848",
    "name": "Firefox",
    "version": "67.0a1",
    "displayVersion": "67.0a1",
    "vendor": "Mozilla",
    "platformVersion": "67.0a1",
    "xpcomAbi": "x86_64-gcc3",
    "channel": "nightly"
  },
  "payload": {
    "os": {
      "name": "Darwin",
      "version": "18.0.0",
      "locale": "en-CA"
    },
    "devices": [
      {
        "os": null,
        "version": null,
        "id": "f38b5add46460b49c7373bac4c99f96bfda39af90ed01ce2b4b24957cd5bbeba",
        "type": "mobile",
        "syncID": "e21b5add46460b49c7373bac4c99f96bfda39af90ed01ce2b4b24957cd5bbeba"
      }
    ],
    "why": "schedule",
    "version": 1,
    "syncs": [
      {
        "when": 1550298047806,
        "took": 2077,
        "why": "schedule",
        "engines": [
          {
            "name": "clients",
            "took": 277
          },
          {
            "name": "tabs",
            "took": 6
          },
          {
            "name": "bookmarks",
            "took": 16
          },
          {
            "name": "forms",
            "took": 4
          },
          {
            "name": "history",
            "took": 394,
            "outgoing": [
              {
                "sent": 8
              }
            ]
          }
        ]
      },
      {
        "when": 1550301657882,
        "took": 2058,
        "devices": [
          {
            "os": "Android",
            "version": "65.0.1",
            "id": "f38b5add46460b49c7373bac4c99f96bfda39af90ed01ce2b4b24957cd5bbeba"
          },
          {
            "os": null,
            "version": null,
            "id": "a38b5add46460b49c7373bac4c99f96bfda39af90ed01ce2b4b24957cd5bbebf"
          }
        ],
        "why": "schedule",
        "engines": [
          {
            "name": "clients",
            "took": 624
          },
          {
            "name": "tabs",
            "took": 3
          },
          {
            "name": "bookmarks",
            "took": 12,
            "steps": [
              {
                "name": "fetchLocalTree",
                "took": 123,
                "counts": [
                  {
                    "name": "items",
                    "count": 1000
                  },
                  {
                    "name": "deletions",
                    "count": 10
                  }
                ]
              },
              {
                "name": "fetchRemoteTree",
                "took": 456
              }
            ]
          },
          {
            "name": "forms",
            "took": 5
          },
          {
            "name": "history",
            "took": 413,
            "outgoing": [
              {
                "sent": 8
              }
            ]
          }
        ]
      }
    ],
    "uid": "43720380d3e0935ca8d715b98d0da438",
    "deviceID": "0dd0695bf3753be0bf3de5f9809b145f68441b65bfeac85d89b31e04718bbaa6",
    "sessionStartDate": "2019-02-15T13:00:00.0-04:00",
    "syncNodeType": "some-type",
    "histograms": {
      "PWMGR_NUM_SAVED_PASSWORDS": {
        "min": 0,
        "max": 100,
        "histogram_type": 0,
        "sum": 5,
        "ranges": [1, 50, 100],
        "counts": [0, 1, 0]
      },
      "PWMGR_BLOCKLIST_NUM_SITES": {
        "min": 0,
        "max": 750,
        "histogram_type": 0,
        "sum": 208,
        "ranges": [175, 196, 219],
        "counts": [0, 1, 0]
      }
    },
    "events": [
      [145994282,"sync","run","maintenance","bookmarks"],
      [162808985,"sync","run","maintenance","bookmarks"],
      [165025232,"sync","open","mirror","success",{"size":"352","serverTime":"1566174585.14"}]
    ]
  }
}
